{
  "version" : "2.0",
  "generatedBy" : "forage-maven-catalog-plugin",
  "timestamp" : 1787668666872,
  "runtimeVersions" : {
    "org.apache.camel" : "4.22.0",
    "org.apache.camel.springboot" : "4.22.0",
    "org.apache.camel.extensions.quarkus" : "3.39.0"
  },
  "factories" : [ {
    "name" : "Agent",
    "factoryType" : "org.apache.camel.component.langchain4j.agent.api.Agent",
    "description" : "Creates AI agents with configurable chat models and memory providers for LangChain4j integration",
    "components" : [ "camel-langchain4j-agent" ],
    "autowired" : true,
    "propertiesFile" : "forage-agent-factory.properties",
    "variants" : {
      "base" : {
        "className" : "io.kaoto.forage.agent.AgentBeanFactory",
        "gav" : "io.kaoto.forage:forage-agent:1.6.0"
      },
      "springboot" : {
        "className" : "io.kaoto.forage.springboot.agent.ForageAgentAutoConfiguration",
        "gav" : "io.kaoto.forage:forage-agent-starter:1.6.0"
      },
      "quarkus" : {
        "className" : "io.kaoto.forage.quarkus.agent.deployment.ForageAgentProcessor",
        "gav" : "io.kaoto.forage:forage-quarkus-agent-deployment:1.6.0"
      }
    },
    "configEntries" : [ {
      "name" : "forage.multi.agent.names",
      "type" : "string",
      "description" : "Comma-separated list of named agent prefixes for multi-agent setup",
      "required" : false,
      "label" : "Agent Names",
      "configTag" : "COMMON"
    }, {
      "name" : "forage.multi.agent.id.source",
      "type" : "string",
      "description" : "Source for extracting agent ID (route-id, header, property, variable)",
      "required" : false,
      "label" : "ID Source",
      "configTag" : "COMMON"
    }, {
      "name" : "forage.multi.agent.id.source.header",
      "type" : "string",
      "description" : "Exchange header name to extract agent ID from",
      "required" : false,
      "label" : "ID Source Header",
      "configTag" : "ADVANCED"
    }, {
      "name" : "forage.multi.agent.id.source.property",
      "type" : "string",
      "description" : "Exchange property name to extract agent ID from",
      "required" : false,
      "label" : "ID Source Property",
      "configTag" : "ADVANCED"
    }, {
      "name" : "forage.multi.agent.id.source.variable",
      "type" : "string",
      "description" : "Exchange variable name to extract agent ID from",
      "required" : false,
      "label" : "ID Source Variable",
      "configTag" : "ADVANCED"
    }, {
      "name" : "forage.provider.model.factory.class",
      "type" : "string",
      "description" : "Fully qualified class name of the model provider factory",
      "required" : false,
      "label" : "Model Factory Class",
      "configTag" : "ADVANCED"
    }, {
      "name" : "forage.provider.features",
      "type" : "string",
      "description" : "Comma-separated list of agent features to enable (e.g., memory)",
      "required" : false,
      "label" : "Features",
      "configTag" : "COMMON"
    }, {
      "name" : "forage.provider.features.memory.factory.class",
      "type" : "string",
      "description" : "Fully qualified class name of the chat memory factory",
      "required" : false,
      "label" : "Memory Factory Class",
      "configTag" : "ADVANCED"
    }, {
      "name" : "forage.provider.agent.class",
      "type" : "string",
      "description" : "Fully qualified class name of the agent factory implementation",
      "required" : false,
      "label" : "Agent Class",
      "configTag" : "ADVANCED"
    }, {
      "name" : "forage.guardrails.input",
      "type" : "string",
      "description" : "Comma-separated list of input guardrail names (@ForageBean values, e.g., pii-detector,keyword-filter)",
      "required" : false,
      "label" : "Input Guardrails",
      "configTag" : "COMMON"
    }, {
      "name" : "forage.guardrails.output",
      "type" : "string",
      "description" : "Comma-separated list of output guardrail names (@ForageBean values, e.g., sensitive-data,output-length)",
      "required" : false,
      "label" : "Output Guardrails",
      "configTag" : "COMMON"
    }, {
      "name" : "forage.agent.model.kind",
      "type" : "bean-name",
      "description" : "The model provider kind (e.g., ollama, openai, google-gemini, azure-openai, anthropic)",
      "required" : true,
      "label" : "Model Kind",
      "configTag" : "COMMON",
      "selectsFrom" : "Chat Model"
    }, {
      "name" : "forage.agent.features",
      "type" : "string",
      "description" : "Comma-separated list of enabled features (e.g., memory)",
      "required" : false,
      "label" : "Features",
      "configTag" : "COMMON"
    }, {
      "name" : "forage.agent.memory.kind",
      "type" : "bean-name",
      "description" : "The memory provider kind (e.g., message-window, redis, infinispan)",
      "required" : false,
      "label" : "Memory Kind",
      "configTag" : "COMMON",
      "selectsFrom" : "Memory"
    }, {
      "name" : "forage.agent.api.key",
      "type" : "password",
      "description" : "API key for authentication with the model provider",
      "required" : false,
      "label" : "API Key",
      "configTag" : "SECURITY"
    }, {
      "name" : "forage.agent.base.url",
      "type" : "string",
      "description" : "Base URL for the model provider API",
      "required" : false,
      "label" : "Base URL",
      "configTag" : "COMMON"
    }, {
      "name" : "forage.agent.model.name",
      "type" : "string",
      "description" : "The specific model name to use",
      "required" : false,
      "label" : "Model Name",
      "configTag" : "COMMON"
    }, {
      "name" : "forage.agent.temperature",
      "type" : "double",
      "description" : "Temperature for response randomness (0.0-2.0)",
      "required" : false,
      "label" : "Temperature",
      "configTag" : "COMMON"
    }, {
      "name" : "forage.agent.max.tokens",
      "type" : "integer",
      "description" : "Maximum number of tokens in the response",
      "required" : false,
      "label" : "Max Tokens",
      "configTag" : "ADVANCED"
    }, {
      "name" : "forage.agent.top.p",
      "type" : "double",
      "description" : "Top-P (nucleus) sampling parameter (0.0-1.0)",
      "required" : false,
      "label" : "Top P",
      "configTag" : "ADVANCED"
    }, {
      "name" : "forage.agent.top.k",
      "type" : "integer",
      "description" : "Top-K sampling parameter",
      "required" : false,
      "label" : "Top K",
      "configTag" : "ADVANCED"
    }, {
      "name" : "forage.agent.endpoint",
      "type" : "string",
      "description" : "Azure OpenAI resource endpoint URL",
      "required" : false,
      "label" : "Endpoint",
      "configTag" : "COMMON"
    }, {
      "name" : "forage.agent.deployment.name",
      "type" : "string",
      "description" : "Azure OpenAI deployment name",
      "required" : false,
      "label" : "Deployment Name",
      "configTag" : "COMMON"
    }, {
      "name" : "forage.agent.log.requests",
      "type" : "boolean",
      "description" : "Enable request logging",
      "required" : false,
      "label" : "Log Requests",
      "configTag" : "ADVANCED"
    }, {
      "name" : "forage.agent.log.responses",
      "type" : "boolean",
      "description" : "Enable response logging",
      "required" : false,
      "label" : "Log Responses",
      "configTag" : "ADVANCED"
    }, {
      "name" : "forage.agent.timeout",
      "type" : "string",
      "description" : "Request timeout duration in ISO-8601 format (e.g. PT120S for 120 seconds)",
      "required" : false,
      "label" : "Timeout",
      "configTag" : "COMMON"
    }, {
      "name" : "forage.agent.memory.max.messages",
      "type" : "integer",
      "description" : "Maximum number of messages to retain in memory",
      "required" : false,
      "defaultValue" : "20",
      "label" : "Max Messages",
      "configTag" : "COMMON"
    }, {
      "name" : "forage.agent.embedding.store.kind",
      "type" : "bean-name",
      "description" : "The embedding store provider kind (e.g., in-memory-store, qdrant, pgvector, redis, milvus)",
      "required" : false,
      "label" : "Embedding Store Kind",
      "configTag" : "COMMON",
      "selectsFrom" : "Embedding Store"
    }, {
      "name" : "forage.agent.in.memory.store.file.source",
      "type" : "string",
      "description" : "Path to a file to be loaded into store.",
      "required" : false,
      "label" : "File source",
      "configTag" : "COMMON"
    }, {
      "name" : "forage.agent.in.memory.store.max.size",
      "type" : "int",
      "description" : "The maximum size of the segment, defined in characters.",
      "required" : false,
      "label" : "Max size",
      "configTag" : "COMMON"
    }, {
      "name" : "forage.agent.in.memory.store.overlap.size",
      "type" : "int",
      "description" : "The maximum size of the overlap, defined in characters.",
      "required" : false,
      "label" : "Overlap size",
      "configTag" : "COMMON"
    }, {
      "name" : "forage.agent.guardrails.input",
      "type" : "string",
      "description" : "Comma-separated list of input guardrail names (@ForageBean values, e.g., pii-detector,keyword-filter)",
      "required" : false,
      "label" : "Input Guardrails",
      "configTag" : "COMMON"
    }, {
      "name" : "forage.agent.guardrails.output",
      "type" : "string",
      "description" : "Comma-separated list of output guardrail names (@ForageBean values, e.g., sensitive-data,output-length)",
      "required" : false,
      "label" : "Output Guardrails",
      "configTag" : "COMMON"
    }, {
      "name" : "forage.agent.embedding.model.api.key",
      "type" : "password",
      "description" : "API key for the embedding model provider (falls back to forage.agent.api.key when not set)",
      "required" : false,
      "label" : "Embedding API Key",
      "configTag" : "SECURITY"
    }, {
      "name" : "forage.agent.embedding.model.base.url",